{
    "kind": "dax_cluster",
    "flavor": "default",
    "version": "0.1",
    "disabled": true,
    "provided": false,
    "depends_on": [],
    "metadata": {
        "name" : "test-dax-cluster",
        "tags": {}
    },
    "spec": {
        "iam_policies": "arn:aws:iam::aws:policy/aws-service-role/DAXServiceRolePolicy",
        "size": {
            "instance": "dax.r4.large"
        },
        "replication_factor": 1
    },
    "advanced": {}
}