{
  "$schema": "mysql.schema.json",
  "kind": "mysql",
  "flavor": "aurora",
  "version": "0.1",
  "disabled": false,
  "provided": false,
  "lifecycle": "ENVIRONMENT_BOOTSTRAP",
  "depends_on": [],
  "metadata": {},
  "spec": {
    "mysql_version": "5.7.mysql_aurora.2.10.1",
    "size": {
      "writer": {
        "instance": "db.t4g.medium",
        "replica_count": 1
      },
      "reader": {
        "replica_count": 0
      }
    }
  },
  "advanced": {
    "aurora": {
      "rds-aurora": {
        "engine_mode": null,
        "allowed_cidr_blocks": [],
        "apply_immediately": true,
        "autoscaling_enabled": true,
        "autoscaling_min_capacity": 2,
        "autoscaling_max_capacity": 4,
        "autoscaling_scale_in_cooldown": 300,
        "autoscaling_scale_out_cooldown": 300,
        "autoscaling_target_cpu": 70,
        "autoscaling_target_connections": 700,
        "cluster_timeouts": {},
        "performance_insights_enabled": true,
        "performance_insights_retention_period": 7,
        "deletion_protection": false,
        "preferred_maintenance_window": "sun:05:00-sun:06:00",
        "preferred_backup_window": "02:00-03:00",
        "skip_final_snapshot": null,
        "snapshot_identifier": null,
        "monitoring_interval": 0,
        "monitoring_role_arn": "",
        "create_db_parameter_group": true,
        "db_parameter_group_use_name_prefix": true,
        "db_parameter_group_name": "test",
        "db_parameter_group_description": "test desc",
        "db_parameter_group_parameters": [],
        "create_db_cluster_parameter_group": true,
        "db_cluster_parameter_group_use_name_prefix": true,
        "db_cluster_parameter_group_name": "test",
        "db_cluster_parameter_group_description": "test desc",
        "db_cluster_parameter_group_parameters": [],
        "create_monitoring_role": false,
        "enable_global_write_forwarding": false,
        "enabled_cloudwatch_logs_exports": [],
        "endpoints": {},
        "replication_source_identifier": null,
        "predefined_metric_type": "RDSReaderAverageCPUUtilization",
        "instance_timeouts": {},
        "iam_roles": {}
      }
    }
  },
  "out": {
    "spec": {
      "mysql_version": "5.7.mysql_aurora.2.10.1",
      "size": {
        "writer": {
          "instance": "db.t4g.medium",
          "replica_count": 1
        },
        "reader": {
          "instance": "db.t4g.medium",
          "replica_count": 0
        }
      }
    },
    "instances": {
    },
    "interfaces": {
      "reader": {
        "username": "",
        "password": "",
        "host": "",
        "port": 6379
      },
      "writer": {
        "username": "",
        "password": "",
        "host": "",
        "port": 6379
      }
    }
  }
}
