{
  "$schema": "https://facets-cloud.github.io/facets-schemas/schemas/service_bus/schema.json",
  "kind": "service_bus",
  "flavor": "azure_service_bus",
  "version": "0.1",
  "lifecycle": "ENVIRONMENT",
  "disabled": true,
  "depends_on": [],
  "metadata": {
    "name": "test-service-bus",
    "tags": {}
  },
  "spec": {
    "size": {
      "sku": "",
      "capacity": ""
    },
    "topics": {
      "test": {
        "name": "",
        "status": "Active"
      },
      "test2": {

      }
    }
  },
  "advanced": {

  },
  "out": {

  }
}
