{
    "$schema": "log_collector.schema.json",
    "flavor": "loki_blob",
    "metadata": {
      "name": "loki-blob-log-collector"
    },
    "kind": "log_collector",
    "provided": false,
    "disabled": true,
    "version": "latest",
    "spec": {
        "retentation_days": 10,
        "storage_size": "10"
    },
    "advanced": {
      "loki_blob": {
        "container_name": "",
        "primary_access_key": "",
        "storage_account_name": ""
      }
    }
  }
  