{
  "$schema": "postgres.schema.json",
  "flavor": "cloudsql",
  "disabled": true,
  "version": "0.1",
  "kind": "postgres",
  "provided": false,
  "metadata": {
    "name": "something"
  },
  "lifecycle": "ENVIRONMENT_BOOTSTRAP",
  "spec": {
    "size": {
      "writer": {
        "instance": "n1-standard-2",
        "volume": "10G"
      },
      "reader": {
        "instance_count": 2,
        "instance": "n1-standard-2",
        "volume": "10G"
      }
    },
    "postgres_version": "12.11"
  },
  "advanced": {
    "cloudsql": {
      "postgres": {
      }
    }
  }
}