{
  "$schema": "https://facets-cloud.github.io/facets-schemas/schemas/uptime/uptime.schema.json",
  "kind": "uptime",
  "flavor": "default",
  "version": "latest",
  "lifecycle": "ENVIRONMENT",
  "disabled": true,
  "provided": false,
  "depends_on": [],
  "metadata": {
    "name": "test-uptime"
  },
  "spec": {
    "http": {
      "url": "https://www.google.com",
      "method": "GET",
      "expected_status_code": "200"
    },
    "mongo": {
      "url": "mongodb+srv://localhost:27017"
    },
    "redis": {
      "url": "redis://localhost:6379"
    },
    "tcp": {
      "url": "google.com:443"
    }
  },
  "advanced": {
    "uptime": {
      "image_pull_policy": "Always",
      "run_interval": "10s",
      "size": {
        "cpu": "1",
        "cpu_limit": "1000m",
        "memory": "1.5Gi",
        "memory_limit": "1.5Gi"
      }
    }
  }
}
