{
  "kind": "helm",
  "flavor": "default",
  "version": "latest",
  "lifecycle": "ENVIRONMENT_BOOTSTRAP",
  "disabled": false,
  "provided": false,
  "metadata": {
  },
  "spec": {
    "chart": "",
    "repository": "",
    "comment": "check here for all attributes https://registry.terraform.io/providers/hashicorp/helm/latest/docs/resources/release",
    "value": {
      "example": {
        "region": "${stack.out.variables.REGION}"
      }
    }
  },
  "out": {
    "comment": "Will be generated, or can be provided",
    "metadata": {
      "chart": "",
      "status": ""
    }
  }
}