{
  "kind": "",
  "flavor": "",
  "metadata": {
  },
  "version": "",
  "$schema": "schemas/mongodb/mongodb.schema.json",
  "spec": {
    "authenticated": false,
    "mongodb_version": "6.0",
    "size": {
      "instance": "",
      "replica_count": 6
    }
  },
  "out": {
   
  },
  "advanced": {
    "k8s": {
    }
  }
}