{
  "$schema": "https://facets-cloud.github.io/facets-schemas/schemas/mysql/mysql.schema.json",
  "kind": "mysql",
  "flavor": "cloudsql",
  "version": "0.1",
  "disabled": true,
  "metadata": {
    "tags": {
      "managed-by": "facets"
    }
  },
  "spec": {
    "mysql_version": "8.0",
    "size": {
      "writer": {
        "instance": "db-f1-micro",
        "volume": "10G"
      },
      "reader": {
        "instance": "db-g1-small",
        "volume": "10G",
        "instance_count": 1
      }
    }
  }
}
