{
  "kind": "application",
  "flavor": "default",
  "version": "latest",

  "disabled": false,
  "provided": true,
  "depends_on": ["application.backend"],
  "metadata": {
    "name": "frontend",
    "labels": {
      "sidecar.istio.io/inject": "true"
    },
    "annotations": {
      "traffic.sidecar.istio.io/excludeOutboundIPRanges": "*"
    }
  },
  "spec": {
    "release": {
      "strategy": "RollingUpdate",
      "build": {
        "artifactory": "default",
        "name": "frontend"
      }
    },
    "runtime": {
      "autoscaling": {
        "min": 1,
        "max": 2,
        "cpuThreshold": 50
      },
      "ports": {
        "grpc": "${template.application.out.ports.grpc}",
        "custom-metrics": 9110
      },
      "metrics": {
        "custom": {
          "portName": "custom-metrics",
          "path": "/"
        }
      },
      "size": "${template.application.out.sizing.GENERAL_PURPOSE.SMALL}"
    },
    "env": {
    },
    "permission": []
  },
  "out": {
    "comment": "Will be generated, or can be provided",
    "interface": {
      "grpc": {
        "port": 1000,
        "host": "app1.namespace",
        "username": "user",
        "password": "password"
      },
      "custom-metrics": {
        "port": 1000,
        "host": "app1.namespace",
        "username": "user",
        "password": "password"
      }
    }
  }
}