{
  "$schema": "https://facets-cloud.github.io/facets-schemas/schemas/log_collector/log_collector.schema.json",
  "kind": "log_collector",
  "flavor": "loki_s3",
  "version": "0.2",
  "disabled": true,
  "metadata": {},
  "spec": {
    "retentation_days": 0,
    "storage_size": ""
  },
  "advanced": {
    "loki_s3": {
      "bucket_name": "<Dollar reference the name of s3 bucket>"
    }
  }
}
