{
  "kind": "template",
  "flavor": "default",
  "version": "latest",

  "disabled": false,
  "provided": true,
  "metadata": {

  },
  "spec": {
  },
  "out": {
    "ports": {
      "grpc": 3000
    },
    "sizing": {
      "GENERAL_PURPOSE": {
        "SMALL":{
          "cpu": "1",
          "memory": "4GB"
        }
      }
    }
  }
}