{
  "kind": "mysql",
  "flavor": "aurora",
  "version": "0.1",
  "disabled": false,
  "provided": false,
  "depends_on": [],
  "metadata": {
    "name": "test-mysql",
    "tags": {}
  },
  "spec": {
    "mysql_version": "5.7.mysql_aurora.2.10.1",
    "size": {
      "writer": {
        "replica_count": 1,
        "instance": "db.t4g.medium"
      },
      "reader": {
        "replica_count": 0,
        "instance": "db.t4g.medium"
      }
    }
  },
  "out": {
    "comment": "Will be generated, or can be provided"
  },
  "advanced": {
    "aurora": {
      "db_cluster_parameters": {
        "max_connections": {
          "apply_method": "pending-reboot",
          "value": "2000"
        },
        "innodb_file_format": {
          "apply_method": "pending-reboot",
          "value": "barracuda"
        },
        "slow_launch_time": {
          "apply_method": "pending-reboot",
          "value": "2"
        },
        "slow_query_log": {
          "apply_method": "pending-reboot",
          "value": "1"
        },
        "query_cache_type": {
          "apply_method": "pending-reboot",
          "value": "0"
        },
        "performance_schema": {
          "apply_method": "pending-reboot",
          "value": "1"
        },
        "max_user_connections": {
          "apply_method": "pending-reboot",
          "value": "2000"
        },
        "character_set_client": {
          "apply_method": "pending-reboot",
          "value": "utf8mb4"
        },
        "character_set_connection": {
          "apply_method": "pending-reboot",
          "value": "utf8mb4"
        },
        "character_set_database": {
          "apply_method": "pending-reboot",
          "value": "utf8mb4"
        },
        "character_set_server": {
          "value": "utf8mb4"
        },
        "character_set_filesystem": {
          "apply_method": "pending-reboot",
          "value": "utf8mb4"
        },
        "character_set_results": {
          "apply_method": "pending-reboot",
          "value": "utf8mb4"
        },
        "collation_connection": {
          "apply_method": "pending-reboot",
          "value": "utf8mb4_unicode_ci"
        },
        "collation_server": {
          "apply_method": "pending-reboot",
          "value": "utf8mb4_unicode_ci"
        },
        "innodb_adaptive_hash_index": {
          "apply_method": "pending-reboot",
          "value": "1"
        },
        "innodb_lock_wait_timeout": {
          "apply_method": "pending-reboot",
          "value": "60"
        },
        "max_allowed_packet": {
          "apply_method": "pending-reboot",
          "value": "16777216"
        },
        "innodb_large_prefix": {
          "apply_method": "pending-reboot",
          "value": "1"
        },
        "explicit_defaults_for_timestamp": {
          "apply_method": "pending-reboot",
          "value": "0"
        },
        "innodb_buffer_pool_size": {
          "apply_method": "pending-reboot",
          "value": "{DBInstanceClassMemory*5/8}"
        }
      },
      "db_instance_parameters": {
        "max_connections": {
          "apply_method": "pending-reboot",
          "value": "2000"
        },
        "slow_launch_time": {
          "apply_method": "pending-reboot",
          "value": "2"
        },
        "slow_query_log": {
          "apply_method": "pending-reboot",
          "value": "1"
        },
        "innodb_file_format": {
          "apply_method": "pending-reboot",
          "value": "Barracuda"
        },
        "query_cache_type": {
          "apply_method": "pending-reboot",
          "value": "0"
        },
        "performance_schema": {
          "apply_method": "pending-reboot",
          "value": "1"
        },
        "max_allowed_packet": {
          "apply_method": "pending-reboot",
          "value": "16777216"
        },
        "max_user_connections": {
          "apply_method": "pending-reboot",
          "value": "2000"
        },
        "innodb_large_prefix": {
          "apply_method": "pending-reboot",
          "value": "1"
        },
        "explicit_defaults_for_timestamp": {
          "apply_method": "pending-reboot",
          "value": "0"
        },
        "innodb_buffer_pool_size": {
          "apply_method": "pending-reboot",
          "value": "{DBInstanceClassMemory*5/8}"
        },
        "net_read_timeout": {
          "value": "3600"
        },
        "net_write_timeout": {
          "value": "3600"
        }
      },
      "monitoring_interval": 5,
      "restore_from": {
        "snapshot_identifier": ""
      },
      "preferred_maintenance_window": {
        "day": "Tue",
        "start_hour": "22",
        "end_hour": "23"
      },
      "preferred_backup_window": {
        "start_hour": "00",
        "end_hour": "01"
      }
    }
  }
}